{
  "name": "Radiohead",
  "description": "My Favorite Songs",
  "privacy": "PUBLIC",
  "songs": [
    { "title": "Everything In Its Right Place", "artist": "Radiohead", "album": "Kid A" },
    { "title": "Kid A", "artist": "Radiohead", "album": "Kid A" },
    { "title": "Hunting Bears", "artist": "Radiohead", "album": "Amnesiac" },
    { "title": "Pulk/Pull Revolving Doors", "artist": "Radiohead", "album": "Amnesiac" },
    { "title": "Fitter Happier", "artist": "Radiohead", "album": "OK Computer" },
    { "title": "Meeting in the Aisle", "artist": "Radiohead", "album": "" },
    { "title": "Subterranean Homesick Alien", "artist": "Radiohead", "album": "OK Computer" },
    { "title": "How to Disappear Completely", "artist": "Radiohead", "album": "Kid A" },
    { "title": "Fake Plastic Trees", "artist": "Radiohead", "album": "The Bends" },
    { "title": "Bullet Proof... I Wish I Was", "artist": "Radiohead", "album": "The Bends" },
    { "title": "Let Down", "artist": "Radiohead", "album": "OK Computer" },
    { "title": "Karma Police", "artist": "Radiohead", "album": "OK Computer" },
    { "title": "Knives Out", "artist": "Radiohead", "album": "Amnesiac" },
    { "title": "Morning Bell", "artist": "Radiohead", "album": "Kid A" },
    { "title": "The Gloaming", "artist": "Radiohead", "album": "Hail to the Thief" },
    { "title": "Feral", "artist": "Radiohead", "album": "The King of Limbs" },
    { "title": "Decks Dark", "artist": "Radiohead", "album": "A Moon Shaped Pool" },
    { "title": "Go to Sleep", "artist": "Radiohead", "album": "Hail to the Thief" },
    { "title": "Burn the Witch", "artist": "Radiohead", "album": "A Moon Shaped Pool" },
    { "title": "Ful Stop", "artist": "Radiohead", "album": "A Moon Shaped Pool" },
    { "title": "Sit Down. Stand Up.", "artist": "Radiohead", "album": "Hail to the Thief" },
    { "title": "Idioteque", "artist": "Radiohead", "album": "Kid A" },
    { "title": "The National Anthem", "artist": "Radiohead", "album": "Kid A" },
    { "title": "Climbing Up the Walls", "artist": "Radiohead", "album": "OK Computer" },
    { "title": "Blow Out", "artist": "Radiohead", "album": "Pablo Honey" },
    { "title": "2 + 2 = 5", "artist": "Radiohead", "album": "Hail to the Thief" },
    { "title": "Myxomatosis", "artist": "Radiohead", "album": "Hail to the Thief" },
    { "title": "Paranoid Android", "artist": "Radiohead", "album": "OK Computer" },
    { "title": "A Wolf at the Door", "artist": "Radiohead", "album": "Hail to the Thief" },
    { "title": "I Am a Wicked Child", "artist": "Radiohead", "album": "" },
    { "title": "Tinker Tailor Soldier Sailor Rich Man Poor Man Beggar Man Thief", "artist": "Radiohead", "album": "A Moon Shaped Pool" },
    { "title": "You and Whose Army?", "artist": "Radiohead", "album": "Amnesiac" },
    { "title": "Gagging Order", "artist": "Radiohead", "album": "" },
    { "title": "Fog (Again)", "artist": "Radiohead", "album": "" },
    { "title": "We Suck Young Blood", "artist": "Radiohead", "album": "Hail to the Thief" },
    { "title": "How I Made My Millions", "artist": "Radiohead", "album": "" },
    { "title": "Faust Arp", "artist": "Radiohead", "album": "In Rainbows" },
    { "title": "Sail to the Moon", "artist": "Radiohead", "album": "Hail to the Thief" },
    { "title": "Lozenge of Love", "artist": "Radiohead", "album": "" },
    { "title": "True Love Waits (Acoustic)", "artist": "Radiohead", "album": "" },
    { "title": "I Will", "artist": "Radiohead", "album": "Hail to the Thief" },
    { "title": "Melatonin", "artist": "Radiohead", "album": "" },
    { "title": "A Reminder", "artist": "Radiohead", "album": "" },
    { "title": "How Can You Be Sure", "artist": "Radiohead", "album": "" },
    { "title": "I Promise", "artist": "Radiohead", "album": "" },
    { "title": "Nude", "artist": "Radiohead", "album": "In Rainbows" },
    { "title": "House of Cards", "artist": "Radiohead", "album": "In Rainbows" },
    { "title": "Go Slowly", "artist": "Radiohead", "album": "In Rainbows Disk 2" },
    { "title": "The Present Tense", "artist": "Radiohead", "album": "A Moon Shaped Pool" },
    { "title": "Scatterbrain", "artist": "Radiohead", "album": "Hail to the Thief" },
    { "title": "Reckoner", "artist": "Radiohead", "album": "In Rainbows" },
    { "title": "Weird Fishes/Arpeggi", "artist": "Radiohead", "album": "In Rainbows" },
    { "title": "All I Need", "artist": "Radiohead", "album": "In Rainbows" },
    { "title": "Identikit", "artist": "Radiohead", "album": "A Moon Shaped Pool" },
    { "title": "Where I End and You Begin", "artist": "Radiohead", "album": "Hail to the Thief" },
    { "title": "Lift", "artist": "Radiohead", "album": "" },
    { "title": "Black Star", "artist": "Radiohead", "album": "The Bends" },
    { "title": "Punchdrunk Lovesick Singalong", "artist": "Radiohead", "album": "" },
    { "title": "High and Dry", "artist": "Radiohead", "album": "The Bends" },
    { "title": "Creep", "artist": "Radiohead", "album": "Pablo Honey" },
    { "title": "Exit Music (For a Film)", "artist": "Radiohead", "album": "OK Computer" },
    { "title": "Bones", "artist": "Radiohead", "album": "The Bends" },
    { "title": "Killer Cars", "artist": "Radiohead", "album": "" },
    { "title": "Bishop's Robes", "artist": "Radiohead", "album": "" },
    { "title": "(Nice Dream)", "artist": "Radiohead", "album": "The Bends" },
    { "title": "Street Spirit (Fade Out)", "artist": "Radiohead", "album": "The Bends" },
    { "title": "These Are My Twisted Words", "artist": "Radiohead", "album": "" },
    { "title": "Life in a Glass House", "artist": "Radiohead", "album": "Amnesiac" },
    { "title": "Like Spinning Plates", "artist": "Radiohead", "album": "Amnesiac" },
    { "title": "Morning Bell/Amnesiac", "artist": "Radiohead", "album": "Amnesiac" },
    { "title": "Pyramid Song", "artist": "Radiohead", "album": "Amnesiac" },
    { "title": "Spectre", "artist": "Radiohead", "album": "" },
    { "title": "The Tourist", "artist": "Radiohead", "album": "OK Computer" },
    { "title": "No Surprises", "artist": "Radiohead", "album": "OK Computer" },
    { "title": "Last Flowers", "artist": "Radiohead", "album": "In Rainbows Disk 2" },
    { "title": "Fog", "artist": "Radiohead", "album": "" },
    { "title": "You Never Wash Up After Yourself", "artist": "Radiohead", "album": "" },
    { "title": "I Want None of This", "artist": "Radiohead", "album": "" },
    { "title": "Daydreaming", "artist": "Radiohead", "album": "A Moon Shaped Pool" },
    { "title": "Codex", "artist": "Radiohead", "album": "The King of Limbs" },
    { "title": "4 Minute Warning", "artist": "Radiohead", "album": "In Rainbows Disk 2" },
    { "title": "Videotape", "artist": "Radiohead", "album": "In Rainbows" },
    { "title": "Harry Patch (In Memory Of)", "artist": "Radiohead", "album": "" },
    { "title": "True Love Waits", "artist": "Radiohead", "album": "A Moon Shaped Pool" },
    { "title": "Motion Picture Soundtrack", "artist": "Radiohead", "album": "Kid A" },
    { "title": "Bloom", "artist": "Radiohead", "album": "The King of Limbs" },
    { "title": "Staircase", "artist": "Radiohead", "album": "" },
    { "title": "Supercollider", "artist": "Radiohead", "album": "" },
    { "title": "Lotus Flower", "artist": "Radiohead", "album": "The King of Limbs" },
    { "title": "Little by Little", "artist": "Radiohead", "album": "The King of Limbs" },
    { "title": "The Numbers", "artist": "Radiohead", "album": "A Moon Shaped Pool" },
    { "title": "Optimistic", "artist": "Radiohead", "album": "Kid A" },
    { "title": "A Punch Up at a Wedding", "artist": "Radiohead", "album": "Hail to the Thief" },
    { "title": "I Might Be Wrong", "artist": "Radiohead", "album": "Amnesiac" },
    { "title": "There There", "artist": "Radiohead", "album": "Hail to the Thief" },
    { "title": "15 Step", "artist": "Radiohead", "album": "In Rainbows" },
    { "title": "Bodysnatchers", "artist": "Radiohead", "album": "In Rainbows" },
    { "title": "Jigsaw Falling Into Place", "artist": "Radiohead", "album": "In Rainbows" },
    { "title": "Bangers + Mash", "artist": "Radiohead", "album": "In Rainbows Disk 2" },
    { "title": "Airbag", "artist": "Radiohead", "album": "OK Computer" },
    { "title": "The Bends", "artist": "Radiohead", "album": "The Bends" },
    { "title": "Just", "artist": "Radiohead", "album": "The Bends" },
    { "title": "My Iron Lung", "artist": "Radiohead", "album": "The Bends" },
    { "title": "India Rubber", "artist": "Radiohead", "album": "" },
    { "title": "Permanent Daylight", "artist": "Radiohead", "album": "" },
    { "title": "Pop Is Dead", "artist": "Radiohead", "album": "" },
    { "title": "Inside My Head", "artist": "Radiohead", "album": "" },
    { "title": "How Do You", "artist": "Radiohead", "album": "Pablo Honey" },
    { "title": "You", "artist": "Radiohead", "album": "Pablo Honey" },
    { "title": "Lucky", "artist": "Radiohead", "album": "OK Computer" }
  ]
}
